message_text,scam_type,manipulation_type,keywords,scam_score,label,source_channel,language,target_audience,attack_vector,scam_stage,scam_intent
ACTION REQUIRED: SBI KYC update mandatory. Click https://bit.ly/q8708 to avoid Rs.500 penalty,bank_kyc_scam,"fear,curiosity","KYC,update",0.86,scam,SMS,english,general,impersonation,initial_contact,identity_theft
161738 is your verification code for Instagram. Never share this OTP.,otp_scam,"urgency,social_engineering","OTP,verification,share,code",0.8,scam,SMS,english,general,otp_request,account_takeover,account_takeover
BOB: Your acount will be deactivated due to inkhatam kare KYC. Varify here: https://tinyurl.com/o8056 🚨,bank_kyc_scam,authority,"KYC,verify,account,deactivated",0.84,scam,WhatsApp,hinglish,general,impersonation,initial_contact,identity_theft
"OTP 311858 for transaction of Rs.10000. If not requested, call +91-9319632046",otp_scam,"urgency,fear",OTP,0.76,scam,SMS,english,general,otp_request,account_takeover,account_takeover
You .. r .. selected .. for .. Google .. Pay .. vacancy. .. Pay .. Rs.100000 .. registration .. fee: .. https://ow.ly/l7767,job_scam,reward,"registration fee,vacancy",0.62,scam,WhatsApp,english,job_seekers,phishing_link,payment_request,steal_information
Your Airtel delivery arriving today between 16:30 AM. Track: 135463622,legitimate_message,none,none,0.07,legitimate,SMS,english,online_shoppers,none,none,none
Your electricity bill for Rs.50000 is due by 10/3/2024. Pay online.,legitimate_message,none,none,0.06,legitimate,SMS,english,general,none,none,none
Tax refund of Rs.2500 approved. Enter bank details: https://cutt.ly/w2579,refund_scam,"urgency,authority,reward","refund,approved,bank details",0.77,scam,SMS,english,online_shoppers,phishing_link,information_theft,steal_information
Part time job! Din ka Rs10000 kamao mobile se join karo: {url},job_scam,urgency,job,0.58,scam,WhatsApp,hinglish,job_seekers,information_theft,initial_contact,financial_fraud
Your flight booking confirmed. PNR: 238242250. Journey: 23/7/2024,legitimate_message,none,confirmed,0.17,legitimate,SMS,english,general,none,none,none
"Dear Sir/Madam, As per RBI guidelines, update your BOB KYC details: https://cutt.ly/v6825",bank_kyc_scam,"authority,curiosity","KYC,update,RBI",0.81,scam,Email,english,elderly,impersonation,initial_contact,identity_theft
You are selected vijeta of Amazon lucky draw - Rs.500! Call +91-7279983986,lottery_scam,"reward,curiosity","winner,lucky draw",0.77,scam,SMS,english,online_shoppers,information_theft,trust_building,financial_fraud
You are eligible for Rs.100000 refund from Jio. Claim: https://ow.ly/i1333 💰,refund_scam,reward,"refund,eligible,claim",0.68,scam,WhatsApp,english,online_shoppers,phishing_link,initial_contact,steal_information
Your WhatsApp account hacked!! Secure it immediately: https://rb.gy/t8370,tech_support_scam,urgency,hacked,0.63,scam,SMS,english,general,impersonation,initial_contact,steal_information
Apka .. account .. lock .. hai .. OTP .. 854664 .. confirm .. kare .. support .. team .. se .. unlock .. ke .. liye .. ⚠️,otp_scam,"urgency,social_engineering","OTP,verification,share,code",0.94,scam,WhatsApp,hinglish,general,otp_request,account_takeover,account_takeover
Your Amazon delivery arriving today between 14:00 AM. Track: 277963546,legitimate_message,none,none,0.0,legitimate,SMS,english,online_shoppers,none,none,none
"OTP for Rs.50000 payment: 102155. To cancel, share this OTP with us on +91-8814587839 🎉",otp_scam,social_engineering,"OTP,share",0.79,scam,WhatsApp,english,general,otp_request,account_takeover,account_takeover
"Dear customer, your IndusInd account credited with Rs.10000 on 4/12/2024",legitimate_message,none,none,0.02,legitimate,Email,english,general,none,none,none
India Post: Your package AWB399644063 held. Clear customs fee: https://short.link/o9209,parcel_delivery_scam,urgency,"customs,package,held",0.8,scam,SMS,english,online_shoppers,phishing_link,payment_request,steal_information
Your ..  .. payment ..  .. of ..  .. Rs.500000 ..  .. failed ..  .. but ..  .. amount ..  .. debited. ..  .. Refund: ..  .. https://bit.ly/s4854,refund_scam,"urgency,reward",refund,0.7,scam,WhatsApp,english,online_shoppers,phishing_link,payment_request,steal_information
UPI MANDATE: Accept recurring payment of Rs.100000/month: https://ow.ly/l2819,upi_payment_scam,urgency,"UPI,payment,Rs,accept",0.68,scam,SMS,english,general,payment_request,payment_request,financial_fraud
SEBI registered investment plan. Triple your investment: https://ow.ly/t3698,investment_scam,urgency,invest,0.79,scam,SMS,english,investors,phishing_link,initial_contact,steal_information
"Dear customer, 372565 is your OTP. Please share to verify your identity - IndusInd Support",otp_scam,"social_engineering,curiosity","OTP,share,verify",0.85,scam,Email,english,general,otp_request,account_takeover,account_takeover
"Last day! Invest Rs.1000 today, get Rs.50000 tomorrow: https://short.link/c6365",investment_scam,reward,invest,0.7,scam,SMS,english,investors,phishing_link,initial_contact,steal_information
ACTION REQUIRED: IDBI KYC update karo mandatory. Click https://short.link/t8196 to avoid Rs.500 penalty,bank_kyc_scam,"fear,curiosity","KYC,update",0.94,scam,SMS,hinglish,general,impersonation,initial_contact,identity_theft
"Dear customer, minimum balance in your Axis account is Rs.50000",legitimate_message,none,none,0.04,legitimate,Email,english,general,none,none,none
DTDC: Your parcel needs Rs.5000 handling charge. Pay here: https://ow.ly/h5762,parcel_delivery_scam,curiosity,parcel,0.75,scam,SMS,english,online_shoppers,phishing_link,payment_request,steal_information
You won Rs.500 in Flipkart lucky draw. Receive via UPI: https://ow.ly/q9444,upi_payment_scam,reward,"UPI,Rs",0.72,scam,SMS,english,online_shoppers,payment_request,trust_building,financial_fraud
Hi! Thanks for contacting Google Pay support. Your ticket number: 466834760,legitimate_message,none,none,0.02,legitimate,SMS,english,general,none,none,none
Rs.500000 pending in your Paytm wallet. Complete verification: https://short.link/i8364,upi_payment_scam,urgency,"Rs,wallet",0.73,scam,SMS,english,general,payment_request,initial_contact,financial_fraud
Govt. of India: You are eligible for PM subsidy Rs.5000. Apply: https://bit.ly/v4240,government_impersonation,fear,Govt,0.82,scam,SMS,english,general,impersonation,initial_contact,identity_theft
DTDC: Your packet needs Rs.1000 handling charge. Pay here: https://cutt.ly/c6020,parcel_delivery_scam,curiosity,parcel,0.82,scam,SMS,english,online_shoppers,phishing_link,payment_request,steal_information
REFUND ALERT: Rs.25000 from Google Pay ready. Verify account: https://ow.ly/b9536,refund_scam,"reward,curiosity",refund,0.71,scam,SMS,english,online_shoppers,phishing_link,information_theft,steal_information
Your Kotak ATM card will be blocked. Update KYC now: https://tinyurl.com/w5011 💰,bank_kyc_scam,"urgency,fear,authority","KYC,blocked,update",0.94,scam,WhatsApp,english,general,impersonation,information_theft,identity_theft
Amazon delivery pending. Update address to receive parcel: https://cutt.ly/u2596,parcel_delivery_scam,curiosity,"parcel,delivery",0.59,scam,SMS,english,online_shoppers,phishing_link,initial_contact,steal_information
Your .. ICICI .. KYC .. is .. expired. .. updat .. within .. 48hrs .. to .. continue .. services: .. https://short.link/m8342 .. 💰,bank_kyc_scam,"urgency,authority","KYC,update",0.77,scam,WhatsApp,english,general,impersonation,initial_contact,identity_theft
Work from home - earn Rs.10000/month. Simple data entry. Register: https://short.link/g6395,job_scam,reward,"work from home,earn",0.6,scam,SMS,english,job_seekers,phishing_link,initial_contact,steal_information
UPI MANDATE: Accept recurring rupay of Rs.10000/month: https://cutt.ly/f7916 ‼️,upi_payment_scam,urgency,"UPI,payment,Rs,accept",0.59,scam,WhatsApp,english,general,payment_request,initial_contact,financial_fraud
Electricity bill refund Rs.1000 pending. Submit bank details: https://rb.gy/m4780,refund_scam,"urgency,authority,reward","refund,bank details,pending",0.77,scam,SMS,english,online_shoppers,phishing_link,information_theft,steal_information
Your appointment with Dr. Reddy confirmed for 1/11/2024 at 13:00 AM,legitimate_message,none,confirmed,0.15,legitimate,SMS,english,general,none,none,none
Google .. hiring .. for .. data .. entry .. - .. Rs.500/month. .. Registration: .. https://short.link/q8763 .. ⚠️,job_scam,urgency,hiring,0.62,scam,WhatsApp,english,job_seekers,phishing_link,initial_contact,steal_information
Electricity bill refund Rs.500000 pending hai. Submit bank details: https://rb.gy/g8572 🎉,refund_scam,"authority,reward,curiosity","refund,bank details,pending",0.81,scam,WhatsApp,english,online_shoppers,phishing_link,information_theft,steal_information
Unauthorized access detected. Verify your account: https://bit.ly/e8131,tech_support_scam,"urgency,curiosity",none,0.75,scam,SMS,english,general,impersonation,information_theft,steal_information
"Dear customer, minimum balance in your Canara account is Rs.500",legitimate_message,none,none,0.03,legitimate,Email,english,general,none,none,none
Google hiring for data entry - Rs.50000/month. Registration: https://rb.gy/g7641 ⚠️,job_scam,reward,hiring,0.74,scam,WhatsApp,english,job_seekers,phishing_link,initial_contact,steal_information
Rs.100000 .. pending .. in .. your .. BHIM .. wallet. .. Complete .. verification: .. https://rb.gy/z4172 .. ⚠️,upi_payment_scam,urgency,"Rs,wallet",0.74,scam,WhatsApp,english,general,payment_request,initial_contact,financial_fraud
Electricity bill refund Rs.500 pending. Submit bank details: https://bit.ly/x9043,refund_scam,"authority,reward,curiosity","refund,bank details,pending",0.76,scam,SMS,english,online_shoppers,phishing_link,information_theft,steal_information
Thank you for shopping with TCS. Order 284976349 confirmed.,legitimate_message,none,"confirmed,thank you",0.16,legitimate,SMS,english,online_shoppers,none,none,none
URGENT: Complete apki IDBI KYC verification to avoid khata suspension. Click: https://rb.gy/o7980,bank_kyc_scam,"urgency,authority,curiosity","KYC,urgent,account",0.81,scam,SMS,english,general,impersonation,initial_contact,identity_theft
"Last day! Invest Rs.50000 today, get Rs.50000 tomorrow: https://tinyurl.com/p2120",investment_scam,reward,invest,0.69,scam,SMS,english,investors,phishing_link,initial_contact,steal_information
FINAL NOTICE: ICICI KYC baki. Complete verification: https://tinyurl.com/c1592 ⚠️,bank_kyc_scam,"urgency,authority",KYC,0.78,scam,WhatsApp,english,general,impersonation,initial_contact,identity_theft
You are eligible for Rs.50000 refund from Google Pay. Claim: https://short.link/r4497,refund_scam,"urgency,reward","refund,eligible,claim",0.77,scam,SMS,english,online_shoppers,phishing_link,initial_contact,steal_information
Courier delivery failed 3 times. Final attempt - update details: https://ow.ly/x9593,parcel_delivery_scam,"urgency,curiosity","delivery,courier",0.69,scam,SMS,english,online_shoppers,phishing_link,initial_contact,steal_information
Your Paytm order 438347595 has been shipped and will arrive by 19/8/2024,legitimate_message,none,none,0.1,legitimate,SMS,english,online_shoppers,none,none,none
You are selected for Jio annual prize Rs.5000. Registration required,lottery_scam,"reward,curiosity",prize,0.77,scam,SMS,english,general,information_theft,trust_building,financial_fraud
Congratulations! Rs.1000 cashback approved. Claim now: https://ow.ly/n2267,upi_payment_scam,"urgency,reward","cashback,Rs",0.75,scam,SMS,english,general,payment_request,trust_building,financial_fraud
Congratulations! Rs.2500 cashback approved. Claim now: https://tinyurl.com/r2055,upi_payment_scam,"urgency,reward","cashback,Rs",0.63,scam,SMS,english,general,payment_request,trust_building,financial_fraud
"Dear .. Sir/Madam, .. As .. per .. RBI .. guidelines, .. updatte .. your .. IndusInd .. KYC .. details: .. https://cutt.ly/v5975",bank_kyc_scam,"authority,curiosity","KYC,update,RBI",0.9,scam,WhatsApp,english,elderly,impersonation,initial_contact,identity_theft
Govt. of India: You are eligible for PM subsidy Rs.2500. Apply: https://bit.ly/n6459,government_impersonation,authority,Govt,0.95,scam,SMS,english,general,impersonation,initial_contact,identity_theft
Your .. IndusInd .. ATM .. card .. will .. be .. blocked. .. Update .. KYC .. now: .. https://rb.gy/k1190 .. 🚨,bank_kyc_scam,"urgency,fear","KYC,blocked,update",0.91,scam,WhatsApp,english,general,impersonation,initial_contact,identity_theft
Rs.25000 pending in your PhonePe wallet. Complete verification: https://rb.gy/g9148,upi_payment_scam,reward,"Rs,wallet",0.82,scam,SMS,english,general,payment_request,initial_contact,financial_fraud
"Work 2 hours daily, earn Rs.500 monthly. Training provided: https://rb.gy/n4581",job_scam,"urgency,reward",earn,0.62,scam,SMS,english,job_seekers,phishing_link,initial_contact,steal_information
"Dear customer, your HDFC account credited with Rs.500000 on 4/3/2024",legitimate_message,none,none,0.02,legitimate,Email,english,general,none,none,none
Income Tax Dept: You have pending refund of Rs.50000. Claim: https://ow.ly/x6381 ⚠️,government_impersonation,"authority,reward",Income Tax,0.87,scam,WhatsApp,english,general,impersonation,initial_contact,identity_theft
Your electricity bill for Rs.50000 is due by 24/10/2024. Pay online.,legitimate_message,none,none,0.18,legitimate,SMS,english,general,none,none,none
ICICI ALERT: Your account requires KYC update. Update now at https://cutt.ly/x2703 or face penalties,bank_kyc_scam,urgency,"KYC,update,account",0.75,scam,SMS,english,general,impersonation,initial_contact,identity_theft
WhatsApp job opportunity - Rs.2500/day. Limited seats: https://rb.gy/k4084,job_scam,urgency,job,0.69,scam,SMS,english,job_seekers,phishing_link,initial_contact,steal_information
Govt. of India lucky draw winner!! You jita Rs.100000 lakhs. Registration: https://ow.ly/e8348,lottery_scam,reward,"winner,lottery,won",0.74,scam,SMS,english,general,phishing_link,trust_building,steal_information
"Dear customer, minimum balance in your IndusInd account is Rs.1000",legitimate_message,none,none,0.16,legitimate,Email,english,general,none,none,none
*Cryptocurrency investment - Rs.500 daily profit. Limited slots: https://short.link/i1493*,investment_scam,urgency,"invest,profit",0.8,scam,SMS,english,investors,phishing_link,initial_contact,steal_information
Confirm OTP 578691 to stop unauthorized transaction of Rs.25000,otp_scam,"fear,social_engineering",OTP,0.89,scam,SMS,english,general,otp_request,account_takeover,account_takeover
Congratulations! Rs.50000 cashback approved. Claim now: https://cutt.ly/v1845,upi_payment_scam,"urgency,reward","cashback,Rs",0.67,scam,SMS,english,general,payment_request,trust_building,financial_fraud
Aapke account me Rs.50000 aaya hai payment accept kare: https://ow.ly/l3753,upi_payment_scam,urgency,"UPI,Rs",0.61,scam,WhatsApp,hinglish,general,payment_request,payment_request,financial_fraud
WhatsApp lottery winner! Rs.25000 prize. Verify on https://rb.gy/p8620,lottery_scam,"reward,curiosity","winner,lottery,prize",0.73,scam,SMS,english,general,phishing_link,information_theft,steal_information
Your Paytm order 837222688 has been shipped and will arrive by 14/3/2024,legitimate_message,none,none,0.28,legitimate,SMS,english,online_shoppers,none,none,none
URGENT: Your package requires redelivery fee of Rs.10000: https://rb.gy/y2976,parcel_delivery_scam,urgency,"delivery,package",0.74,scam,SMS,english,online_shoppers,phishing_link,payment_request,steal_information
Receive Rs.5000 reward by accepting payment request: https://ow.ly/d7284,upi_payment_scam,reward,"payment,Rs,accept",0.61,scam,SMS,english,general,payment_request,payment_request,financial_fraud
WhatsApp job opportunity - Rs.25000/day. Limited seats: https://rb.gy/f3192,job_scam,reward,job,0.61,scam,SMS,english,job_seekers,phishing_link,initial_contact,steal_information
"Last day!! Invest Rs.1000 today, get Rs.50000 tomorrow: https://bit.ly/m4962",investment_scam,urgency,invest,0.78,scam,SMS,english,investors,phishing_link,initial_contact,steal_information
"Train ticket booked: PNR 852932388, Journey date: 19/10/2024",legitimate_message,none,booked,0.01,legitimate,SMS,english,general,none,none,none
Income Tax notice for Rs.5000 unpaid tax. Pay imediately: https://bit.ly/o5464,government_impersonation,"urgency,authority",Income Tax,0.91,scam,SMS,english,general,impersonation,initial_contact,identity_theft
Reminder: Your BOB credit card payment of Rs.500 due on 14/8/2024,legitimate_message,none,reminder,0.16,legitimate,SMS,english,general,none,none,none
URGENT: Your package requires redelivery fee of Rs.500000: https://short.link/n1924 ❌,parcel_delivery_scam,urgency,"delivery,package",0.81,scam,WhatsApp,english,online_shoppers,phishing_link,payment_request,steal_information
Reminder: Your IDBI credit card payment of Rs.500 due on 8/2/2024,legitimate_message,none,reminder,0.28,legitimate,SMS,english,general,none,none,none
Join our trading group. Make Rs.50000 daily from home: https://ow.ly/t9878,investment_scam,reward,trading,0.71,scam,SMS,english,investors,phishing_link,initial_contact,steal_information
PAN Card blocked by Income Tax Dept. Reactivate: https://tinyurl.com/g9003,government_impersonation,"urgency,fear,authority","Income Tax,PAN",0.83,scam,SMS,english,general,impersonation,initial_contact,identity_theft
Your OTP for Facebook login is 807515. Valid for 10 minutes. Do not share.,legitimate_message,none,OTP,0.07,legitimate,SMS,english,general,none,none,none
Tax refund of Rs.100000 approved. Enter bank details: https://tinyurl.com/o2106,refund_scam,"authority,reward,curiosity","refund,approved,bank details",0.79,scam,SMS,english,online_shoppers,phishing_link,information_theft,steal_information
Sar .. ICICI .. ka .. account .. band .. hone .. wala .. hai .. turant .. KYC .. update .. kare: .. https://ow.ly/h8201,bank_kyc_scam,"urgency,authority","KYC,blocked,update",0.82,scam,WhatsApp,hinglish,general,impersonation,initial_contact,identity_theft
UPI MANDATE: Accept recurring payment of Rs.500/month: https://bit.ly/t1453,upi_payment_scam,urgency,"UPI,payment,Rs,accept",0.76,scam,SMS,english,general,payment_request,payment_request,financial_fraud
SEBI registered investment plan. Triple your investment: https://rb.gy/g7707,investment_scam,urgency,invest,0.75,scam,SMS,english,investors,phishing_link,initial_contact,steal_information
Your khata is locked. Verify OTP 996054 with support team to unlock 🚨,otp_scam,"social_engineering,curiosity","OTP,verify",0.8,scam,WhatsApp,english,general,otp_request,account_takeover,account_takeover
REFUND ALERT: Rs.5000 from Airtel ready. Verify account: https://rb.gy/v1781 ⏰,refund_scam,"reward,curiosity",refund,0.83,scam,WhatsApp,english,online_shoppers,phishing_link,information_theft,steal_information
Your OTP for Facebook login is 341518. Valid for 10 minutes. Do not share.,legitimate_message,none,OTP,0.2,legitimate,SMS,english,general,none,none,none
WINNER ALERT: ur number won Rs.25000 crores in lottery. Claim code: WIN1489,lottery_scam,reward,"winner,lottery,won,claim",0.68,scam,SMS,english,general,information_theft,trust_building,financial_fraud
You are selected for Jio annual prize Rs.10000. Registration required,lottery_scam,"reward,curiosity",prize,0.73,scam,SMS,english,general,information_theft,trust_building,financial_fraud
Courier delivry failed 3 times. Final attempt - update kare details: https://ow.ly/m5796,parcel_delivery_scam,"urgency,curiosity","delivery,courier",0.69,scam,WhatsApp,english,online_shoppers,phishing_link,initial_contact,steal_information
Congratulations! Rs.500 cashback approved. Claim now: https://cutt.ly/d6245,upi_payment_scam,"urgency,reward","cashback,Rs",0.73,scam,SMS,english,general,payment_request,trust_building,financial_fraud
Thank you for shopping with PhonePe. Order 572522964 confirmed.,legitimate_message,none,"confirmed,thank you",0.17,legitimate,SMS,english,online_shoppers,none,none,none
Courier delivery failed 3 times. Final attempt - update details: https://short.link/y4182,parcel_delivery_scam,"urgency,curiosity","delivery,courier",0.73,scam,SMS,english,online_shoppers,phishing_link,initial_contact,steal_information
Your Netflix subscription renewed successfully. Amount: Rs.25000,legitimate_message,none,none,0.11,legitimate,SMS,english,general,none,none,none
CONGRATULATIONS! You won iPhone 15 + Rs.5000 cash. Claim: https://cutt.ly/b6654 🎉,lottery_scam,reward,"congratulations,won,claim",0.71,scam,WhatsApp,english,general,phishing_link,trust_building,steal_information
WARNING: 14 malware detected. Install secrity patch: https://cutt.ly/e2142 💰,tech_support_scam,urgency,"security,malware",0.73,scam,WhatsApp,english,general,malware_link,initial_contact,spread_malware
Hi! Thanks for contacting Google Pay support. Your ticket number: 773114471,legitimate_message,none,none,0.07,legitimate,SMS,english,general,none,none,none
Your PhonePe delivery arriving today between 13:00 PM. Track: 740776735,legitimate_message,none,none,0.14,legitimate,SMS,english,online_shoppers,none,none,none
Rs.100000 lagao aur Rs.50000 kamao 30 din me 100% guarantee: https://cutt.ly/w7236,investment_scam,urgency,"invest,returns,guaranteed",0.87,scam,WhatsApp,hinglish,investors,phishing_link,initial_contact,steal_information
ALERT: Rs.2500 debited from your account. Dispute payment: https://cutt.ly/l6740,upi_payment_scam,reward,"payment,Rs",0.65,scam,SMS,english,general,payment_request,payment_request,financial_fraud
ALERT: Rs.10000 debited from your account. Dispute payment: https://rb.gy/u7782,upi_payment_scam,urgency,"payment,Rs",0.78,scam,SMS,english,general,payment_request,payment_request,financial_fraud
ur .. number .. is .. selected .. in .. Google .. Pay .. mega .. lottery .. Rs.5000 .. crores!!,lottery_scam,reward,lottery,0.81,scam,WhatsApp,english,general,information_theft,trust_building,financial_fraud
Your appointment with Dr. Reddy confirmed for 12/4/2024 at 9:30 AM,legitimate_message,none,confirmed,0.19,legitimate,SMS,english,general,none,none,none
"Dear customer, 215935 is your OTP. Please share to verify your identity - ICICI Support",otp_scam,"urgency,social_engineering,curiosity","OTP,share,verify",0.78,scam,Email,english,general,otp_request,account_takeover,account_takeover
FINAL NOTICE: ICICI KYC pending. Complete verification: https://bit.ly/u9973,bank_kyc_scam,urgency,KYC,0.84,scam,SMS,english,general,impersonation,initial_contact,identity_theft
Your Gmail subscription renewed successfully. Amount: Rs.25000,legitimate_message,none,none,0.12,legitimate,SMS,english,general,none,none,none
UPI MANDATE: Accept recurring payment of Rs.500/month: https://rb.gy/l4028,upi_payment_scam,reward,"UPI,payment,Rs,accept",0.56,scam,SMS,english,general,payment_request,payment_request,financial_fraud
India Post: Your package AWB889806283 held. Clear customs fee: https://ow.ly/h7094,parcel_delivery_scam,curiosity,"customs,package,held",0.77,scam,SMS,english,online_shoppers,phishing_link,payment_request,steal_information
Sir aapka PNB account ka KYC expire ho gaya hai jaldi update karo nahi to account block ho jayega: https://short.link/l5831 🚨,bank_kyc_scam,"urgency,fear",KYC,0.88,scam,WhatsApp,hinglish,elderly,impersonation,initial_contact,identity_theft
PNB: Your acount will be deactivated due to incomplete KYC. Verrify here: https://cutt.ly/r7573 ⏰,bank_kyc_scam,fear,"KYC,verify,account,deactivated",0.77,scam,WhatsApp,english,general,impersonation,initial_contact,identity_theft
Part time job! Din ka Rs.100000 kamao mobile se join karo: https://ow.ly/y7346,job_scam,reward,"work from home,earn",0.69,scam,WhatsApp,hinglish,job_seekers,phishing_link,initial_contact,steal_information
Invest Rs.2500 get Rs.50000 in 30 days! 100% guaranteed returns: https://ow.ly/t9143,investment_scam,reward,"invest,returns,guaranteed",0.75,scam,SMS,english,investors,phishing_link,initial_contact,steal_information
Electricity bill refund Rs.500000 pending. Submit bank details: https://ow.ly/s6003,refund_scam,"urgency,authority,reward","refund,bank details,pending",0.84,scam,SMS,english,online_shoppers,phishing_link,information_theft,steal_information
Thank you for shopping with Amazon. Order 551825369 confirmed.,legitimate_message,none,"confirmed,thank you",0.27,legitimate,SMS,english,online_shoppers,none,none,none
WhatsApp lottery winner! Rs.50000 prize. Verify on https://tinyurl.com/u7013,lottery_scam,"reward,curiosity","winner,lottery,prize",0.84,scam,SMS,english,general,phishing_link,information_theft,steal_information
Your Flipkart subscription renewed successfully. Amount: Rs.5000,legitimate_message,none,none,0.2,legitimate,SMS,english,online_shoppers,none,none,none
"Dear customer, 772475 is your OTP. Please share to verify your identity - HDFC Support",otp_scam,"social_engineering,curiosity","OTP,share,verify",0.84,scam,Email,english,general,otp_request,account_takeover,account_takeover
Meeting reminder: Team sync scheduled for 11/5/2024 at 16:00 AM,legitimate_message,none,reminder,0.21,legitimate,SMS,english,general,none,none,none
"Dear customer, your Canara account credited with Rs.10000 on 22/9/2024",legitimate_message,none,none,0.09,legitimate,Email,english,general,none,none,none
Part-time naukri alert! Earn Rs.2500 daily from mobile. Join: https://ow.ly/d5312 🚨,job_scam,reward,"job,earn",0.58,scam,WhatsApp,english,job_seekers,phishing_link,initial_contact,steal_information
Infosys owes you Rs.25000 wapsi. Last day to claim: https://cutt.ly/u3234 🚨,refund_scam,reward,"refund,claim",0.74,scam,WhatsApp,english,online_shoppers,phishing_link,initial_contact,steal_information
*UIDAI ALERT: Aadhaar deactivated. Re-varify within 48 hours: https://bit.ly/l9159*,government_impersonation,"urgency,fear,authority","Aadhaar,UIDAI",0.81,scam,SMS,english,general,impersonation,initial_contact,identity_theft
