message_text,scam_type,manipulation_type,keywords,scam_score,label,source_channel,language,target_audience,attack_vector,scam_stage,scam_intent
Your Amazon password changed by someone. Reset here: https://bit.ly/p7490,tech_support_scam,urgency,none,0.61,scam,SMS,english,online_shoppers,impersonation,initial_contact,steal_information
"Last day! Invest Rs.10000 today, get Rs.1000000 tomorrow: https://ow.ly/j9812",investment_scam,urgency,invest,0.75,scam,SMS,english,investors,phishing_link,initial_contact,steal_information
SEBI registered investment plan. Triple tumhara lagao: https://short.link/f4597,investment_scam,urgency,invest,0.84,scam,SMS,hinglish,investors,phishing_link,initial_contact,steal_information
INDIA .. POST: .. YOUR .. PACKAGE .. AWB740890979 .. HELD. .. CLEAR .. CUSTOMS .. FEE: .. HTTPS://RB.GY/L2327,parcel_delivery_scam,urgency,"customs,package,held",0.65,scam,WhatsApp,english,online_shoppers,information_theft,payment_request,financial_fraud
110825  is  your  verification  code  for  WhatsApp.  Never  share  this  OTP.,otp_scam,"urgency,social_engineering","OTP,verification,share,code",0.84,scam,SMS,english,general,otp_request,account_takeover,account_takeover
Your Instagram subscription renewed successfully. Amount: Rs.25000,legitimate_message,none,none,0.23,legitimate,SMS,english,general,none,none,none
Part-time job alert! Earn Rs.50000 daily from mobile. Join: https://short.link/v2959,job_scam,"urgency,reward","job,earn",0.6,scam,SMS,english,job_seekers,phishing_link,initial_contact,steal_information
Your .. OTP .. is .. 570889. .. DO .. NOT .. share .. with .. anyone. .. Valid .. for .. 10 .. minutes.,otp_scam,social_engineering,"OTP,share",0.88,scam,WhatsApp,english,general,otp_request,account_takeover,account_takeover
Your TCS delivery arriving today between 13:30 PM. Track: 504087539,legitimate_message,none,none,0.01,legitimate,SMS,english,online_shoppers,none,none,none
Your appointment with Dr. Reddy confirmed for 6/3/2024 at 11:30 AM,legitimate_message,none,confirmed,0.16,legitimate,SMS,english,general,none,none,none
Your OTP for WhatsApp login is 205103. Valid for 10 minutes. Do not share.,legitimate_message,none,OTP,0.09,legitimate,SMS,english,general,none,none,none
Your Flipkart delivery arriving today between 12:00 PM. Track: 555462801,legitimate_message,none,none,0.28,legitimate,SMS,english,online_shoppers,none,none,none
Income Tax notice for Rs.2500 unpaid tax. Pay immediately: https://cutt.ly/h5016,government_impersonation,"urgency,authority",Income Tax,0.94,scam,SMS,english,general,impersonation,initial_contact,identity_theft
Your Jio order 943486382 has been shipped and will arrive by 3/2/2024,legitimate_message,none,none,0.08,legitimate,SMS,english,online_shoppers,none,none,none
Tax refund of Rs.2500 approved. Enter bank details: https://short.link/n2759,refund_scam,"urgency,authority,reward","refund,approved,bank details",0.85,scam,SMS,english,online_shoppers,phishing_link,information_theft,steal_information
"OTP 908090 for transaction of Rs.10000. If not requested, call +91-7570712738",otp_scam,"urgency,fear",OTP,0.77,scam,SMS,english,general,otp_request,account_takeover,account_takeover
Government approved scheme - Double your money in 6 months: https://tinyurl.com/i8259,investment_scam,"urgency,authority",none,0.86,scam,SMS,english,investors,phishing_link,initial_contact,financial_fraud
Welcome to Netflix! Your registration is complete.,legitimate_message,none,none,0.18,legitimate,SMS,english,general,none,none,none
Your .. BOB .. ATM .. card .. will .. be .. blocked. .. Updatte .. KYC .. now: .. https://tinyurl.com/d1474 .. 💰,bank_kyc_scam,"urgency,fear","KYC,blocked,update",0.9,scam,WhatsApp,english,general,impersonation,initial_contact,identity_theft
Badhai ho! Rs.100000 cashback mil gaya claim karo: https://bit.ly/q7426 ✅,upi_payment_scam,"urgency,reward","UPI,Rs",0.68,scam,WhatsApp,hinglish,general,payment_request,initial_contact,financial_fraud
Your OTP is 563422. DO NOT share with anyone. Valid for 10 minutes.,otp_scam,"urgency,social_engineering","OTP,share",0.77,scam,SMS,english,general,otp_request,account_takeover,account_takeover
Ayushman Bharat: You are eligible for Rs.2500 health benefit: https://bit.ly/a8455 ❌,government_impersonation,fear,none,0.76,scam,WhatsApp,english,general,impersonation,initial_contact,identity_theft
Congratulations! Rs.10000 cashback approved. Claim now: https://rb.gy/s8617 🚨,upi_payment_scam,"urgency,reward","cashback,Rs",0.76,scam,WhatsApp,english,general,payment_request,trust_building,financial_fraud
Your Flipkart delivery arriving today between 18:00 PM. Track: 414374159,legitimate_message,none,none,0.05,legitimate,SMS,english,online_shoppers,none,none,none
SEBI registered investment plan. Triple your investment: https://tinyurl.com/i2677,investment_scam,urgency,invest,0.86,scam,SMS,english,investors,phishing_link,initial_contact,steal_information
Your appointment with Dr. Reddy confirmed for 12/11/2024 at 13:00 AM,legitimate_message,none,confirmed,0.28,legitimate,SMS,english,general,none,none,none
Your Aadhaar is being used for illegal activities. Verify identity: https://bit.ly/c2060 ✅,government_impersonation,"fear,authority,curiosity",Aadhaar,0.88,scam,WhatsApp,english,general,impersonation,information_theft,identity_theft
REFUND ALERT: Rs.500 credited. Verify payment link: https://bit.ly/x4094,upi_payment_scam,"urgency,reward,curiosity","payment,refund,credited,Rs",0.68,scam,SMS,english,general,payment_request,payment_request,financial_fraud
You r selected winner of Jio lucky draw - Rs.500! Call +91-9154667734,lottery_scam,reward,"winner,lucky draw",0.88,scam,SMS,english,general,information_theft,trust_building,financial_fraud
Hi! Thanks for contacting TCS support. Your ticket number: 285153042,legitimate_message,none,none,0.07,legitimate,SMS,english,general,none,none,none
You are selected winner of PhonePe lucky draw - Rs.5000! Call +91-9615588801 ⏰,lottery_scam,reward,"winner,lucky draw",0.66,scam,WhatsApp,english,general,information_theft,trust_building,financial_fraud
Your TCS order is stuck at port. Pay import duty Rs.5000: https://rb.gy/n4272,parcel_delivery_scam,urgency,duty,0.7,scam,SMS,english,online_shoppers,phishing_link,payment_request,steal_information
Join our trading group. Make Rs.25000 daily from home: https://short.link/l9337,investment_scam,urgency,trading,0.77,scam,SMS,english,investors,phishing_link,initial_contact,steal_information
LUCKY DRAW WINNER!! RS.10000 DEPOSITING IN 24HRS. CONFIRM DETAILS: HTTPS://BIT.LY/Y1495,lottery_scam,"reward,social_engineering,curiosity","winner,lucky draw",0.7,scam,SMS,english,general,information_theft,payment_request,financial_fraud
759719 is aapka security code. Bank official will ask for this to unblock aapka account,otp_scam,"urgency,authority","code,security",0.75,scam,SMS,hinglish,general,otp_request,account_takeover,account_takeover
URGENT: TCS hiring for home-based jobs. No experience needed: https://short.link/m8386,job_scam,"urgency,reward","job,hiring",0.7,scam,SMS,english,job_seekers,phishing_link,initial_contact,steal_information
Stock market expert tips - 1000% returns guaranteed. Subscribe: https://cutt.ly/j9729,investment_scam,reward,"returns,guaranteed",0.74,scam,SMS,english,investors,phishing_link,initial_contact,steal_information
Unauthorized access detected. Verify your account: https://bit.ly/b6462,tech_support_scam,"urgency,curiosity",none,0.84,scam,SMS,english,general,impersonation,information_theft,steal_information
Your Amazon akount hacked! Secure it turant: https://cutt.ly/o3903 🎉,tech_support_scam,"urgency,fear",hacked,0.68,scam,WhatsApp,english,online_shoppers,impersonation,initial_contact,steal_information
BlueDart: Delivery attempted. Pay Rs.1000 to reschedule: https://tinyurl.com/z1867,parcel_delivery_scam,curiosity,delivery,0.78,scam,SMS,english,online_shoppers,payment_request,payment_request,financial_fraud
Your Google Pay order 785299966 has been shipped and will arrive by 15/3/2024,legitimate_message,none,none,0.1,legitimate,SMS,english,online_shoppers,none,none,none
IMPORTANT: IndusInd account frozen due to KYC non-compliance. Update immediately: https://cutt.ly/p2760,bank_kyc_scam,"urgency,fear,authority","KYC,update,account",0.78,scam,SMS,english,general,impersonation,initial_contact,identity_theft
Reminder: Your ICICI credit card payment of Rs.500000 due on 18/1/2024,legitimate_message,none,reminder,0.26,legitimate,SMS,english,general,none,none,none
Join our trading group. Make Rs.10000 daily from home: https://bit.ly/m7736,investment_scam,reward,trading,0.76,scam,SMS,english,investors,phishing_link,initial_contact,steal_information
Your Google Pay limit increased to Rs.100000. Activate now: https://cutt.ly/l1273,upi_payment_scam,urgency,Rs,0.75,scam,SMS,english,general,payment_request,initial_contact,financial_fraud
Congratulations! Rs.5000 cashback approved. Claim now: https://ow.ly/m5190,upi_payment_scam,"urgency,reward","cashback,Rs",0.78,scam,SMS,english,general,payment_request,trust_building,financial_fraud
You are eligible for Rs.50000 refund from Jio. Claim: https://bit.ly/p2589,refund_scam,"urgency,reward","refund,eligible,claim",0.65,scam,SMS,english,online_shoppers,phishing_link,initial_contact,steal_information
Congratulations selected ho Paytm job ke liye Rs.{amount} registration fee bhare: https://rb.gy/z4150,job_scam,"urgency,reward",hiring,0.66,scam,SMS,english,job_seekers,phishing_link,payment_request,steal_information
Your .. phone .. data .. being .. stolen. .. Microsoft .. support: .. Call .. +91-8653847058 .. ⚠️,tech_support_scam,"urgency,social_engineering",none,0.81,scam,WhatsApp,english,general,impersonation,initial_contact,steal_information
Sir 459491 apka verification code hai is OTP ko share karke account verify kare 💰,otp_scam,"social_engineering,curiosity","OTP,share",0.81,scam,WhatsApp,hinglish,general,otp_request,account_takeover,account_takeover
Join .. our .. trading .. group. .. Make .. Rs.10000 .. daily .. from .. home: .. https://bit.ly/b2954,investment_scam,reward,trading,0.66,scam,WhatsApp,english,investors,phishing_link,initial_contact,steal_information
Join our trading group. Make Rs.1000 daily from home: https://short.link/v1936,investment_scam,reward,trading,0.67,scam,SMS,english,investors,phishing_link,initial_contact,steal_information
"Dear customer, your Axis account credited with Rs.500000 on 14/1/2024",legitimate_message,none,none,0.14,legitimate,Email,english,general,none,none,none
Your .. Flipkart .. parcel .. is .. held .. at .. shulk. .. Pay .. Rs.25000 .. duty: .. https://rb.gy/k4741,parcel_delivery_scam,curiosity,"parcel,customs,duty,held",0.81,scam,WhatsApp,english,online_shoppers,phishing_link,payment_request,steal_information
Hi! Thanks for contacting Infosys support. Your ticket number: 656741042,legitimate_message,none,none,0.25,legitimate,SMS,english,general,none,none,none
Your flight booking confirmed. PNR: 914267154. Journey: 2/1/2024,legitimate_message,none,confirmed,0.19,legitimate,SMS,english,general,none,none,none
Receive Rs.100000 reward by accepting payment request: https://tinyurl.com/f7089,upi_payment_scam,urgency,"payment,Rs,accept",0.62,scam,SMS,english,general,payment_request,payment_request,financial_fraud
"Train ticket booked: PNR 105694070, Journey date: 25/5/2024",legitimate_message,none,booked,0.24,legitimate,SMS,english,general,none,none,none
WINNER ALERT: Your number won Rs.2500 crores in lottery. Claim code: WIN5880 ⚠️,lottery_scam,"reward,curiosity","winner,lottery,won,claim",0.8,scam,WhatsApp,english,general,information_theft,trust_building,financial_fraud
Your Infosys order 224194355 has been shipped and will arrive by 26/5/2024,legitimate_message,none,none,0.28,legitimate,SMS,english,online_shoppers,none,none,none
PNB: Your account will be deactivated due to incomplete KYC. Verify here: https://ow.ly/k8978,bank_kyc_scam,"authority,curiosity","KYC,verify,account,deactivated",0.85,scam,SMS,english,general,impersonation,information_theft,identity_theft
"OTP 735901 for transaction of Rs.500000. If not requested, call +91-9034241297",otp_scam,"fear,social_engineering",OTP,0.85,scam,SMS,english,general,otp_request,account_takeover,account_takeover
"Dear .. Sir/Madam, .. As .. per .. RBI .. guidelines, .. update .. ur .. Kotak .. KYC .. details: .. https://tinyurl.com/n9042",bank_kyc_scam,"urgency,authority,curiosity","KYC,update,RBI",0.94,scam,WhatsApp,english,elderly,impersonation,initial_contact,identity_theft
Your .. phone .. will .. be .. locked .. in .. 24 .. ghante .. due .. 2 .. vairas. .. Fix .. now: .. https://rb.gy/q9950,tech_support_scam,urgency,virus,0.61,scam,WhatsApp,english,general,impersonation,initial_contact,steal_information
Kotak: .. Your .. accout .. will .. be .. deactivated .. due .. to .. inkhatam .. kare .. KYC. .. Verify .. here: .. https://ow.ly/t8311 .. ❌,bank_kyc_scam,"urgency,curiosity","KYC,verify,account,deactivated",0.94,scam,WhatsApp,hinglish,general,impersonation,information_theft,identity_theft
Your WhatsApp password changed by someone. Reset here: https://tinyurl.com/a5748,tech_support_scam,fear,none,0.65,scam,SMS,english,general,impersonation,initial_contact,steal_information
948378 is tumhara safety code. Bank official will ask for this to unblock apki account,otp_scam,"urgency,authority,social_engineering","code,security",0.75,scam,SMS,english,general,otp_request,account_takeover,account_takeover
"Last day! Invest Rs.50000 today, get Rs.50000 tomorrow: https://rb.gy/o6099",investment_scam,urgency,invest,0.76,scam,SMS,english,investors,phishing_link,initial_contact,steal_information
502526 is your security code. Bank official will ask for this to unblock your account,otp_scam,"urgency,authority","code,security",0.76,scam,SMS,english,general,otp_request,account_takeover,account_takeover
WhatsApp investment group - Rs.500 to Rs.500000 in 1 month guaranteed,investment_scam,urgency,"invest,guaranteed",0.75,scam,SMS,english,investors,information_theft,initial_contact,financial_fraud
IndusInd ALERT: Your account requires KYC update. Update now at https://bit.ly/p3874 or face penalties 💰,bank_kyc_scam,"urgency,fear","KYC,update,account",0.77,scam,WhatsApp,english,general,impersonation,initial_contact,identity_theft
Your OTP for Netflix login is 514204. Valid for 10 minutes. Do not share.,legitimate_message,none,OTP,0.29,legitimate,SMS,english,general,none,none,none
Welcome to Instagram! Your registration is complete.,legitimate_message,none,none,0.02,legitimate,SMS,english,general,none,none,none
"Dear Sir/Madam, As per RBI guidelines, update your SBI KYC details: https://rb.gy/y9370",bank_kyc_scam,"authority,curiosity","KYC,update,RBI",0.89,scam,Email,english,elderly,impersonation,initial_contact,identity_theft
"Dear customer, minimum balance in your Canara account is Rs.500000",legitimate_message,none,none,0.16,legitimate,Email,english,general,none,none,none
Your Google Pay order 209672718 has been shipped and will arrive by 17/5/2024,legitimate_message,none,none,0.24,legitimate,SMS,english,online_shoppers,none,none,none
India Post: Your package AWB955775591 held. Clear customs fee: https://short.link/s9379,parcel_delivery_scam,curiosity,"customs,package,held",0.58,scam,SMS,english,online_shoppers,phishing_link,payment_request,steal_information
URGENT: Infosys hiring for home-based jobs. No experience needed: https://cutt.ly/z5017,job_scam,urgency,"job,hiring",0.71,scam,SMS,english,job_seekers,phishing_link,initial_contact,steal_information
CONGRATULATIONS! You won iPhone 15 + Rs.500 cash. Claim: https://tinyurl.com/u5061,lottery_scam,reward,"congratulations,won,claim",0.82,scam,SMS,english,general,phishing_link,trust_building,steal_information
"Dear Sir/Madam, As per RBI guidelines, update ur Axis KYC details: https://rb.gy/b4795",bank_kyc_scam,"urgency,authority,curiosity","KYC,update,RBI",0.76,scam,Email,english,elderly,impersonation,initial_contact,identity_theft
VIRUS ALERT: Your phone is infected. Clean now: https://short.link/n4249,tech_support_scam,urgency,"virus,alert,infected",0.79,scam,SMS,english,general,malware_link,initial_contact,spread_malware
Confirm OTP 919213 to stop unauthorized transaction of Rs.500,otp_scam,"urgency,fear,social_engineering",OTP,0.79,scam,SMS,english,general,otp_request,account_takeover,account_takeover
LUCKY DRAW WINNER! Rs.1000 depositing in 24hrs. Confirm details: https://cutt.ly/f1723,lottery_scam,"reward,social_engineering,curiosity","winner,lucky draw",0.84,scam,SMS,english,general,phishing_link,payment_request,steal_information
URGENT: Bitcoin trading me invest karo 400% profit pakka hai: https://bit.ly/x6240,investment_scam,urgency,invest,0.72,scam,SMS,hinglish,investors,phishing_link,initial_contact,steal_information
UPI MANDATE: Accept recurring payment of Rs.10000/month: https://bit.ly/y8816,upi_payment_scam,reward,"UPI,payment,Rs,accept",0.6,scam,SMS,english,general,payment_request,payment_request,financial_fraud
Your payment of Rs.25000 failed but amount debited. Refund: https://ow.ly/b5307,refund_scam,reward,refund,0.83,scam,SMS,english,online_shoppers,phishing_link,payment_request,steal_information
REFUND ALERT: Rs.25000 credited. Verify payment link: https://cutt.ly/a7222,upi_payment_scam,"urgency,reward,curiosity","payment,refund,credited,Rs",0.77,scam,SMS,english,general,payment_request,payment_request,financial_fraud
Parcel delivery failed. Reschedule by paying Rs.100000 charges: https://bit.ly/f1412,parcel_delivery_scam,urgency,"parcel,delivery",0.64,scam,SMS,english,online_shoppers,phishing_link,payment_request,steal_information
GST refund of Rs.5000 approved by govt. Claim now: https://ow.ly/w1868,refund_scam,"urgency,reward","refund,claim,approved",0.73,scam,SMS,english,online_shoppers,phishing_link,initial_contact,steal_information
You are selected for PhonePe vacancy. Pay Rs.25000 registration fee: https://short.link/q6383,job_scam,reward,"registration fee,vacancy",0.63,scam,SMS,english,job_seekers,payment_request,payment_request,financial_fraud
Electricity bill refund Rs.50000 pending. Submit bank details: https://cutt.ly/r4666,refund_scam,"urgency,authority,reward","refund,bank details,pending",0.67,scam,SMS,english,online_shoppers,phishing_link,information_theft,steal_information
UIDAI ALERT: Aadhaar deactivated. Re-verify within 48 hours: https://ow.ly/n3884,government_impersonation,"urgency,authority,curiosity","Aadhaar,UIDAI",0.84,scam,SMS,english,general,impersonation,information_theft,identity_theft
CONGRATULATIONS! You won Rs.10000 in KBC lottery. Claim: https://tinyurl.com/o6387,lottery_scam,"reward,curiosity","lottery,congratulations,won,claim",0.66,scam,SMS,english,general,phishing_link,trust_building,steal_information
URGENT: Your package requires redelivery fee of Rs.5000: https://cutt.ly/i4626,parcel_delivery_scam,urgency,"delivery,package",0.66,scam,SMS,english,online_shoppers,phishing_link,payment_request,steal_information
Apple Security: Your iCloud hacked. Immediate action required: https://cutt.ly/u7898,tech_support_scam,"urgency,fear","hacked,security",0.65,scam,SMS,english,general,impersonation,initial_contact,steal_information
Your Amazon delivery arriving today between 17:00 PM. Track: 260659188,legitimate_message,none,none,0.3,legitimate,SMS,english,online_shoppers,none,none,none
Your appointment with Dr. Patel confirmed for 22/7/2024 at 13:30 PM,legitimate_message,none,confirmed,0.02,legitimate,SMS,english,general,none,none,none
Parcel delivery failed. Reschedule by paying Rs.25000 charges: https://cutt.ly/n9900,parcel_delivery_scam,urgency,"parcel,delivery",0.57,scam,SMS,english,online_shoppers,phishing_link,payment_request,steal_information
Invest Rs.10000 get Rs.250000 in 30 days! 100% guaranteed returns: https://bit.ly/y6666,investment_scam,urgency,"invest,returns,guaranteed",0.75,scam,SMS,english,investors,phishing_link,initial_contact,steal_information
Your OTP for WhatsApp login is 233840. Valid for 10 minutes. Do not share.,legitimate_message,none,OTP,0.28,legitimate,SMS,english,general,none,none,none
Earn Rs.50000 by liking YouTube videos. No investment needed: https://short.link/j4203,job_scam,reward,earn,0.77,scam,SMS,english,job_seekers,phishing_link,initial_contact,steal_information
Your Gmail subscription renewed successfully. Amount: Rs.500,legitimate_message,none,none,0.25,legitimate,SMS,english,general,none,none,none
Your Aadhaar is being used for illegal activities. Verify identity: https://rb.gy/r9318,government_impersonation,"fear,authority,curiosity",Aadhaar,0.95,scam,SMS,english,general,impersonation,information_theft,identity_theft
CRITICAL: Your device compromised. Google security alert: https://ow.ly/v8993,tech_support_scam,fear,"security,alert",0.62,scam,SMS,english,general,impersonation,initial_contact,steal_information
Confirm OTP 234758 to stop unauthorized transaction of Rs.25000 🚨,otp_scam,"urgency,fear,social_engineering",OTP,0.76,scam,WhatsApp,english,general,otp_request,account_takeover,account_takeover
UPI MANDATE: Accept recurring payment of Rs.500000/month: https://bit.ly/d9983,upi_payment_scam,reward,"UPI,payment,Rs,accept",0.7,scam,SMS,english,general,payment_request,payment_request,financial_fraud
Your Amazon order 502461821 has been shipped and will arrive by 14/6/2024,legitimate_message,none,none,0.17,legitimate,SMS,english,online_shoppers,none,none,none
"Dear customer, 892171 is aapki OTP. Please share to verify aapka identity - HDFC Support",otp_scam,"social_engineering,curiosity","OTP,share,verify",0.85,scam,Email,hinglish,general,otp_request,account_takeover,account_takeover
Tax refund of Rs.500 approved. Enter bank details: https://rb.gy/w1658,refund_scam,"authority,reward,curiosity","refund,approved,bank details",0.77,scam,SMS,english,online_shoppers,phishing_link,information_theft,steal_information
Your Paytm delivery arriving today between 17:30 AM. Track: 481558847,legitimate_message,none,none,0.3,legitimate,SMS,english,online_shoppers,none,none,none
YOUR GOOGLE PAY LIMIT INCREASED TO RS.10000. ACTIVATE NOW: HTTPS://SHORT.LINK/T6460,upi_payment_scam,urgency,Rs,0.6,scam,SMS,english,general,payment_request,initial_contact,financial_fraud
Your OTP for Amazon login is 422473. Valid for 10 minutes. Do not share.,legitimate_message,none,OTP,0.15,legitimate,SMS,english,online_shoppers,none,none,none
WhatsApp lottery winner! Rs.25000 prize. Verify on https://short.link/n5253,lottery_scam,"reward,curiosity","winner,lottery,prize",0.69,scam,SMS,english,general,phishing_link,information_theft,steal_information
Your phone will be locked in 24 hours due to virus. Fix now: https://bit.ly/i7541,tech_support_scam,"urgency,fear",virus,0.65,scam,SMS,english,general,malware_link,initial_contact,spread_malware
Insurance refund approved - Rs.50000. Process within 24hrs: https://rb.gy/s9211,refund_scam,"urgency,reward","refund,approved",0.74,scam,SMS,english,online_shoppers,phishing_link,initial_contact,steal_information
Courier delivery failed 3 times. Final attempt - update details: https://rb.gy/g1792,parcel_delivery_scam,"urgency,curiosity","delivery,courier",0.77,scam,SMS,english,online_shoppers,phishing_link,initial_contact,steal_information
"Dear customer, 832768 is your OTP. Please share to verify your identity - ICICI Support",otp_scam,"urgency,social_engineering,curiosity","OTP,share,verify",0.78,scam,Email,english,general,otp_request,account_takeover,account_takeover
"Dear customer, minimum balance in your SBI account is Rs.10000",legitimate_message,none,none,0.06,legitimate,Email,english,general,none,none,none
Your number is selected in Jio mega inam Rs.5000 crores!,lottery_scam,reward,lottery,0.75,scam,SMS,english,general,information_theft,trust_building,financial_fraud
Your Paytm delivery arriving today between 10:00 AM. Track: 247860233,legitimate_message,none,none,0.11,legitimate,SMS,english,online_shoppers,none,none,none
Your Reliance order is stuck at port. Pay import duty Rs.500000: https://short.link/f8889,parcel_delivery_scam,curiosity,duty,0.7,scam,SMS,english,online_shoppers,phishing_link,payment_request,steal_information
Aadhaar Card suspended due to KYC mismatch. Update immediately: https://tinyurl.com/r4255,government_impersonation,"urgency,fear,authority",Aadhaar,0.87,scam,SMS,english,general,impersonation,initial_contact,identity_theft
Your Flipkart subscription renewed successfully. Amount: Rs.2500,legitimate_message,none,none,0.15,legitimate,SMS,english,online_shoppers,none,none,none
Meeting reminder: Team sync scheduled for 23/5/2024 at 18:00 AM,legitimate_message,none,reminder,0.25,legitimate,SMS,english,general,none,none,none
Your Aadhaar is being used for illegal activities. Verify identity: https://bit.ly/v4355,government_impersonation,"fear,authority,curiosity",Aadhaar,0.86,scam,SMS,english,general,impersonation,information_theft,identity_theft
Your electricity bill for Rs.10000 is due by 16/9/2024. Pay online.,legitimate_message,none,none,0.17,legitimate,SMS,english,general,none,none,none
Parcel delivery failed. Reschedule by paying Rs.2500 charges: https://tinyurl.com/f3780,parcel_delivery_scam,curiosity,"parcel,delivery",0.67,scam,SMS,english,online_shoppers,phishing_link,payment_request,steal_information
Income Tax notice for Rs.50000 unpaid tax. Pay immediately: https://tinyurl.com/e3595,government_impersonation,"urgency,fear,authority",Income Tax,0.79,scam,SMS,english,general,impersonation,initial_contact,identity_theft
Your IDBI ATM card will be blocked. Updatte KYC now: https://cutt.ly/j6407,bank_kyc_scam,"urgency,fear","KYC,blocked,update",0.82,scam,SMS,english,general,impersonation,initial_contact,identity_theft
Reminder: Your SBI credit card payment of Rs.500000 due on 21/9/2024,legitimate_message,none,reminder,0.1,legitimate,SMS,english,general,none,none,none
